Tema,Título,Enlace,Noticia
politica,"“La bomba económica le puede explotar a Sergio Massa antes del 10 de diciembre”, afirmó un asesor clave de Javier Milei",https://www.clarin.com/politica//politica/asesor-clave-javier-milei-bomba-economica-puede-explotar-sergio-massa-10-diciembre_0_wGi2fh9Ih1.html,"Luego de la polémica frase de Patricia Bullrich sobre la posibilidad de que la economía “explote” antes del balotaje del 19 de noviembre, ahora el designado ministro del Interior de Javier Milei en caso de ganar la presidencia, Guillermo Francos, se expresó en el mismo sentido. El ex titular del BID vaticinó que “la bomba” le puede “explotar a Sergio Massa antes del 10 de diciembre”.
En diálogo con Radio Millenium, Francos subrayó que el ministro de Economía y candidato de Unión por la Patria “está gobernando la Argentina hace 15 meses” e hizo “todo lo contrario a lo que decís que vas a hacer de acá para adelante”.
“No se le puede mentir a la gente de esta manera. Del Massa político esto es lo que a mi me disgusta”, agregó el dirigente de La Libertad Avanza y enfatizó que las medidas del ""plan patita"" del ministro y candidato están “incrementando el déficit” y “va a significar inflación futura”.
En ese sentido, consultado por la periodista Romina Manguel sobre la “bomba” económica que se ha generado, Francos afirmó: “Le puede explotar a él antes del 10 de diciembre”.
“Massa es una persona que está luchando por el poder desesperadamente. Sabe que está en una situación difícil y está haciendo todo lo posible, no le importa lo que pase después, ya verá cómo lo soluciona”, agregó.
Según Francos, Massa lo resolverá “diciendo todo lo contrario a lo que dijo”. “O lo va a solucionar generando más emisión y más inflación que es lo más probable que haga”, añadió.
De acuerdo al análisis del ladero de Milei, si el ministro apuesta a más emisión monetaria “terminamos en un desastre total”. “Si hace ajuste, va a tener un problema con su propia fuerza. Él también está en una encrucijada, pero como posterga el tema, él lo que quiere es tener el poder”, manifestó.
En línea con el vaticino de que ""la bomba económica"" puede explotar antes del fin del mandato de Alberto Fernández, Francos puso como ejemplo la crisis por la falta de nafta vivida la semana pasada en todo el país.
""Han pasado cosas estos días que no se pueden dejar de tener en cuenta. Como lo que pasó la semana pasada con el combustible y lo que pasa en el interior con el combustible"", indicó.
""Ojalá no explote nunca (la bomba). No digo que explote, digo que (a Massa) se le escapan variables de la economía que generan más distorsión"", añadió el ex funcionario del BID.
Massa, sus asesores brasileños y ""la campaña del miedo""
Francos opinó también sobre lo que llamó una ""campaña negativa"" contra dirigentes libertarios y contra la fuerza. En ese sentido, responsabilizó a Sergio Massa.
""Todos sabemos quiénes lo asesoran a Massa en la campaña. Tiene un equipo de asesores brasileños, catalanes, pero está claro que el equipo que él tiene de brasileños son especialistas en campañas negativas"", reveló Francos. 
Ofuscado porque, de acuerdo a su análisis, Unión por la Patria acusa a los libertarios de impulsar una ""campaña del miedo, lanzó: ""Que (Massa) no me venga a decir que la campaña del miedo la instalamos nosotros. La campaña del miedo la han organizado muy bien todo este equipo de asesores"".
Francos reconoció que La Libertad Avanza cometió ""errores"" con algunas declaraciones que luego, afirma, ""se toman porque son polémicas"". Aunque quiso evitar el tema, terminó haciendo referencia a la propuesta de venta de órganos que desde el kirchnerismo afirman que propone Milei. 
""Es inconducente"", dijo Franco en relación a la venta de órganos y explicó que fue un tema que surgió como ""una cuestión filosófica"". 
""Ese tema surgió a partir de una cuestión filosófica sobre el liberalismo y el mercado. El tema no lo introdujo Milei en la conversación, sino que se lo plantearon"", recordó. 
""Surgió, pero no es una propuesta de La Libertad Avanza como lo quiso instalar Massa. Por eso digo que la campaña del miedo"", añadió.
D.D."
politica,Qué pronostica para el balotaje la encuestadora brasileña que anticipó triunfo de Massa en octubre,https://www.clarin.com/politica//politica/pronostica-balotaje-encuestadora-brasilena-anticipo-triunfo-massa-octubre_0_rBcTP96mKA.html,"A principios de octubre, cuando faltaban (como ahora) aún un par de semanas para la elección, la consultora brasileña Atlas Intel sacudió al mundo de la política: mientras el resto de las encuestadoras pronosticaba un triunfo de Javier Milei y el debate era si podría ganar en primera vuelta, la firma extranjera publicó una encuesta que daba primero y relativamente cómodo a Sergio Massa. Fue el indicio bautismal ante la opinión pública de lo que terminaría ocurriendo y que, vale reconocerlo, también lo anticiparon luego otros analistas.
En este días, Atlas Intel difundió su encuesta de cara al balotaje, que en este caso se suma a la hipótesis que vienen sosteniendo otros colegas: aseguran que hay un escenario parejo, con Milei levemente arriba. 
El estudio de la consultora brasileña incluyó 3.218 casos online, entrevistados entre el 1 y el 3 de noviembre (miércoles y viernes pasados), con +/- 2,2% de margen de error.
Números clave para la segunda vuelta
De entrada, en un completo informe de 64 páginas, lo primero que muestra la encuesta de Atlas son los números para la segunda vuelta. Y con indecisos y blanco, y también cuando sólo proyecta votos afirmativos, prevalece el candidato libertario. Alerta para la Rosada.
""¿Por quién vas a votar en la segunda vuelta de las elecciones presidenciales?"", plantea el estudio. Y de arranque, Milei le saca casi 4 puntos Massa: 48,5% contra 44,7%, con 2,9% de blancos, 2,5% de indecisos y 2,4% de nulos.
Luego, cuando se proyectan los votos afirmativos, la ventaja se estira a 4 puntos exactos: 52% a 48%. La clave de este resultado, en el pronóstico de Atlas, es que Milei se estaría quedando con más del 70% de los votos de Patricia Bullrich en primera vuelta.
Para entender el contexto: Massa terminó en la primera vuelta con 36,78% contra 29,99% de Milei. Una diferencia de 6,79 puntos y 1,8 millón de votos. Bullrich llegó a casi 6,4 millón de votos: un magro 23,81% que la dejó afuera de la batalla del 19 de noviembre pero que convirtieron a sus electores en el botín más atractivo para esa puja.
La otra pecera atractiva es la de Juan Schiaretti, el peronista moderado que sumó 6,73% y 1,8 millón de votos. En este caso, Atlas difiere de otros estudios, que aseguran que la mayoría de los votantes del cordobés podría irse con Milei: para la firma brasileña, casi el 49% votará a Massa y el 35% al libertario.
En cuanto al resto de los detalles del voto por edad, lugar de residencia, género y otros parámetros, lo más descollante sigue siendo lo de Milei entre los jóvenes: más del 61% de los que tienen entre 16 y 24 años se inclinan por el economista de La Libertad Avanza. Es en el único grupo que se perfora el techo de los 60 puntos.
Para Massa, la clave parece seguir estando en la provincia de Buenos Aires, más precisamente en el Conurbano, donde le gana 55% a 38% a su rival.
 Falta de nafta y dolarización
La encuesta de Atlas se mete también con dos de los tópicos de campaña que más fuerte sonaron esta semana: la falta de combustibles y la confirmación de Milei de que, en caso de ganar, avanzará con la dolarización.
En cuanto a la escasez de combustibles, casi un 50% responsabiliza al ministro de Economía por los faltantes, pese a que él intentó apuntar contra las petroleras y hasta agitó el miedo sobre el precio del producto si ganan los libertarios.
Respecto a la dolarización, dos datos: es más la gente que está en contra (49%) que a favor (36%). Pero también son más (38,4% contra 31,1%), los que creen que Milei cumplirá con su promesa monetaria si gana la elección que los que descreen."
politica,Alerta en la cúpula de la Iglesia por el apoyo de un cura villero a Massa,https://www.clarin.com/politica//politica/alerta-cupula-iglesia-apoyo-cura-villero-massa_0_5NNcbmGRPI.html,"La irrupción de Javier Milei en la política con su perfil disruptivo provocó un sacudón en todos los estamentos de la sociedad. Ni la Iglesia -que desde la vuelta a la democracia venía cuidándose de no quedar involucrada en las sucesivas campañas políticas- se salvó, provocando tensiones internas.
La última consecuencia se produjo esta semana cuando el padre José María “Pepe” Di Paola -el conocido cura villero- dijo en una entrevista con Télam Radio que una persona de fe no puede votar al libertario porque sus ideas colisionan frontalmente con las premisas de las religiones.
Su afirmación obligó a fuentes de la Conferencia Episcopal a decir que las afirmaciones del padre Pepe eran “a título personal” y, por tanto, no deben tomarse como la posición de la Iglesia, institución a la que no le corresponde “decir a sus fieles por quién votar y por quién no”.
Obviamente, en los ámbitos eclesiásticos hay una coincidencia en el rechazo a los insultos y durísimas críticas que Milei le propinó al Papa hace unos años y a los severos cuestionamientos recientes. El propio Francisco aludió implícitamente al libertario de modo crítico.
Pero otra cosa -dijeron las fuentes- es que un sacerdote que debe estar por encima de todas las parcialidades políticas para preservarse como factor de unión de todos los fieles se pronuncie sobre cómo deben votar los creyentes porque es avanzar sobre su libertad.
En paralelo, el obispo de San Francisco, Córdoba, Sergio Buenanueva, escribió una reflexión que subió a las redes, en la que se refiere al papel de los clérigos ante el voto de los fieles en base al desarrollo de la Doctrina Social de la Iglesia.
“La Iglesia, con sabiduría pastoral, hoy prefiere orientar la conciencia ofreciendo a los fieles católicos una serie de principios, criterios y enseñanzas que ayuden a cada uno a tomar una decisión prudencial”, afirma.
Sin referirse en ningún momento al padre Pepe, Buenanueva completa: “Ese es el camino de la libertad que respeta la dignidad de la persona humana como tal. Ese es también el fundamento del sistema democrático”.
De todas maneras, teniendo en cuenta que a muchos católicos no los convencen los candidatos que llegaron al balotaje, el obispo de Formosa, José Conejero Gallego, salió a decir que el voto en blanco “es una opción”.
“Si la ciudadanía no se siente representada por ninguno de los candidatos o si la decisión pasa por elegir al menos malo puede votar en blanco”, señaló en línea con la doctrina católica que lo considera una vía extrema.
El padre Di Paola había dicho que “ninguna persona de fe puede inclinarse por una propuesta electoral activadores e inhumana” como la de Milei, y señaló que lo que plantea el libertario “es una regresión de la civilización”.
Tras criticar su posición sobre el uso de armas y la venta de órganos, dijo que “ninguna religión” está de acuerdo con esos postulados, “ni tampoco ninguna persona que se sienta ligada a un tipo de humanismo”.
En el pasado haya Milei había insultado y acusado al Papa de ser “la encarnación del Maligno”; además, criticó que promueva la justicia social porque “un robo porque le saca al que trabaja”.
Estas posiciones determinaron que, tras las PASO, los curas villeros oficiaran una misa de desagravio a Francisco, una decisión que generó un debate en la Iglesia sobre la oportunidad de su realización.
A los pocos días, el presidente del Episcopado, monseñor Oscar Ojea, afirmó que el Papa “es para nosotros un profeta de la dignidad humana en un tiempo de violencia y exclusión” y que “es también un Jefe de Estado al que se le debe un respeto particular”.
Luego Milei dijo que desde que abrazó la política había moderado su estilo, pero al día siguiente, en una entrevista a un polémico periodista norteamericano, acusó al Papa de “tener afinidad con dictaduras sangrientas”.
Finalmente, el referente intelectual de Milei, Alberto Benegas Lynch (h.), propuso romper relaciones diplomáticas con el Vaticano “mientras en la cabeza de la Iglesia haya una mentalidad totalitaria”."
