Tema,Título,Enlace,Noticia
economia,Feriado bancario: qué operaciones no se podrán hacer este lunes,https://www.clarin.com/economia//economia/feriado-bancario-operaciones-podran-hacer-lunes_0_M89z9VD01w.html,"Este lunes 6 de noviembre no abrirá ninguna de las entidades financieras de todo el país por el Día del Trabajador Bancario. Aunque no se podrá operar de forma presencial, hay alternativas online para realizar distintos trámites.
Este día no laborable por los 99 años de la creación de la Asociación Bancaria afecta la atención por caja, pero no afectará el homebanking y las distintas aplicaciones de los bancos. 
También funcionarán con normalidad las distintas billeteras virtuales para hacer pagos por transferencia. 
A pesar del feriado dispuesto por la Comisión Nacional de Valores (CNV) se mantendrán activas las alternativas de online y los cajeros automáticos, y la extracción en comercios adheridos como supermercados y estaciones de servicios.
Además, se podrán realizar depósitos, extracciones de efectivo y pago de tarjetas de crédito.
Las operatorias con vencimiento ese mismo día se liquidarán al día siguiente, como así también las liquidaciones de la Administración Nacional de la Seguridad Social (ANSeS).
Para los pagos que realiza la ANSeS, como el que hace todos los meses a jubilados y otros beneficiarios sociales, el calendario mensual ya incluye la previsión de feriados. 
Por ende, la próxima semana, comenzará para estos trámites el día martes 7. Así, los DNI finalizados en 6 y 7 cobran el martes 7 y los que terminan en 8 y 9 el miércoles 8 de noviembre.
Qué pasa con el dólar
Lo que no se podrá hacer son transacciones financieras que impliquen actividad cambiaria, ya que no cotizarán el dólar oficial ni los financieros.
﻿De hecho, por el Día del Trabajador Bancario, la Comisión Nacional de Valores también declaró feriado bursátil."
economia,Euro hoy: a cuánto cotiza este domingo 05 de noviembre,https://www.clarin.com/economia//economia/euro-hoy-cotiza-domingo-05-noviembre_0_aWRbqr5tDf.html," El euro cotiza este domingo 05 de noviembre a $375.46 para la compra y $375.76 para la venta, por lo que se mantiene estable respecto a la última cotización. 
 En cuanto a la divisa en el mercado paralelo, el euro blue hoy cotiza a 936.43 para la compra y 989.94 para la venta. De este modo, su precio sube en relación al último informado. 
 Con estos valores, la brecha entre el euro blue y el euro oficial​ es de 149%. 
 El valor del euro blue tiene una diferencia sustancial más alta con el euro oficial ya que este último es el que se adquiere en los bancos y que posee una cotización establecida. 
 ¿Por qué se llama euro blue? 
 Al igual que el dólar blue, el euro blue es el que circula en el mercado negro y suele tener un valor más alto que el oficial. Una explicación sobre su denominación señala que se llama así porque en inglés, ""blue"", además de nombrar al color azul, remite a algo ""oscuro"". De esta manera, se reconoce al cambio de la divisa por fuera del sistema cambiario. 
 El término euro blue se empezó a utilizar a partir del 2011, como consecuencia de las restricciones para la adquisición de moneda extranjera que comenzaron a aplicar la Administración Federal de Ingresos Públicos (AFIP) y el Banco Central de la República Argentina bajo el gobierno de Cristina Fernández de Kirchner. 
 Estas limitaciones cobraron un nuevo impulso en diciembre de 2019, luego de los anuncios de presidente Alberto Fernández sobre la Ley de Emergencia económica y que se profundizaron a lo largo del 2020 con el cepo cambiario. Esto genera que los sectores que viajen al exterior opten por la compra de euros en el mercado negro, generando así un aumento en el precio del euro blue.
 Origen del Euro 
 El euro se lanzó el 1° de enero de 1999, cuando 10 países fijaron sus tipos de cambio y entregaron las decisiones sobre las tasas de interés al recién creado Banco Central Europeo. Los billetes y monedas de euro entraron en circulación tres años después. 
 La moneda compartida se vio como una solución a las constantes disputas por los tipos de cambio que habían marcado la política europea después de la Segunda Guerra Mundial y como una extensión lógica de la zona de libre comercio de aranceles de la Unión Europea. Gran Bretaña, en particular, optó por no participar, pero 19 de los 27 países de la UE utilizan el euro como moneda nacional. Quienes componen la zona del euro, también denominada ""eurozona"" son: AustriaBélgicaChipreEstoniaFinlandiaFranciaAlemaniaGreciaIrlandaItaliaLetoniaLituaniaLuxemburgoMaltaPaíses BajosPortugalEslovaquiaEsloveniaEspaña"
economia,Dólar blue hoy: a cuánto cotiza este domingo 05 de noviembre,https://www.clarin.com/economia//economia/dolar-blue-hoy-cotiza-domingo-05-noviembre_0_pwybqxPelp.html,"La cotización del dólar blue es de $905 para la compra y de $925 para la venta, este domingo 05 de noviembre de 2023.
La cotización del dólar blue en los últimos 30 días
En lo que va de noviembre de 2023, el dólar blue sube respecto al mes anterior: la diferencia es de 3%.
La cotización del dólar blue en el año
En lo que va de este 2023, el dólar blue sube respecto al 2022: la diferencia es de 218%.
La brecha entre el dólar oficial y el dólar blue
El valor del dólar blue tiene una diferencia sustancial con el dólar oficial, que se adquiere en los bancos y que posee una cotización establecida. La brecha entre el dólar oficial y el dólar blue es de 159%.
Qué es el dólar blue
El dólar blue es el que circula en el mercado negro y suele tener un valor más alto que el oficial. Este dólar no se compra en bancos o casas de cambio oficiales.
A qué hora cierra la cotización del dólar blue
La cotización del dólar blue cierra junto con la del dólar oficial: a las 15 horas, de lunes a viernes.
Por qué se denomina dólar blue
Una explicación sobre su denominación señala que se llama así porque ""blue"", en inglés, además de nombrar al color azul, remite a algo ""oscuro"". Otra teoría lo relaciona con las operaciones de compra a través de bonos o acciones de compañías conocidas como ""blue chips"". Y también se lo vincula con el color aproximado que aparece cuando se aplica un fibrón para detectar billetes falsos.
Cotización del dólar oficial
La cotización del dólar oficial es de $348.96 para la compra y de $368.60 para la venta, este domingo 05 de noviembre de 2023, según el Banco Nación.
Cotización dólar bolsa
La cotización del dólar bolsa es de $839.70 para la compra y de $844 para la venta, este domingo 05 de noviembre de 2023.
Cotización dólar CCL
La cotización del dólar CCL es de $856.70 para la compra y de $840.95 para la venta, este domingo 05 de noviembre de 2023."
economia,Israel debe destruir a Hamás para sobrevivir,https://www.clarin.com/economia//economia/israel-debe-destruir-hamas-sobrevivir_0_EpDQtpeCcv.html,"Después del sábado 7 de octubre cuando Hamás le infligió 1.400 muertos a su población civil y secuestró 239 israelíes y extranjeros, Israel no tiene otra alternativa que destruir a la organización terrorista y eliminar uno por uno a sus cuadros dirigentes y a la mayor parte de sus operativos.
Lo que está en juego ahora es la supervivencia del Estado israelí y de su población; y se puede asegurar que si Hamás persiste como fuerza militar todavía en control de la Franja de Gaza una vez terminada la guerra, Israel estará letalmente debilitado y habrá perdido para siempre su capacidad de disuasión frente a sus múltiples enemigos de Medio Oriente y el mundo, encabezados por Irán.
Esto implica que la situación de Israel se habrá tornado invivible, lo que obligará a los israelíes forzosamente a salir del país, reiniciando su camino milenario de éxodo colectivo.
Todo depende ahora de la capacidad de combate de las Fuerzas de Defensa Israelíes (FDI) para destruir a Hamás y desmantelar irreversiblemente su estructura militar y logística.
El dilema estratégico de Israel surgido de la lógica de los hechos tiene un carácter trágico y al mismo tiempo extremadamente simple.
“Todo en la estrategia es simple, pero lo simple es difícil”, dice Clausewitz; y todo se conjuga en tiempo presente y con un carácter intransferible. Este es el problema estratégico central que está en el núcleo de este conflicto histórico, y en este momento específico del siglo XXI.
Es una situación en que el inevitable tono apocalíptico surge de los acontecimientos y del contexto mundial, y no solo es una pasión del cerebro.
En estas condiciones, lo único que puede limitar su alcance es que se logre una conclusión tajante y definitiva, cualquiera sea el tiempo que lleve y las consecuencias que desate.
Hay que dar como un hecho la extensión del conflicto, y ante todo el vuelco a la guerra de Hezbollah, la expresión político-militar de la comunidad chiita en el Líbano, y por su intermedio de Irán.
Por su parte EE.UU. respondió la semana pasada por primera vez a los ataques de la Guardia Islámica Republicana (Fuerza QUTS) iraní destacada en territorio sirio, señalando el Pentágono que era una “…advertencia” al régimen del Ayatollah Khamenei en Teherán.
EE.UU. tiene desplegadas dos Fuerzas de Ataque navales en la región, encabezadas por sendos portaaviones nucleares (US. Gerald Ford y US. Dwight D. Eisenhower) en los que están embarcados casi 5.000 “marines” integrantes de la 21ava Fuerza Expedicionaria.
En el caso cada vez menos hipotético de un vuelco a la guerra de Hezbollah, la 21ava Fuerza Expedicionaria podría desembarcar en territorio libanés, como lo hizo en forma repetida en la década del ’80 y del ’90, lo que a su vez llevaría a la intervención de Irán en respaldo de su principal aliada en la región que es la fuerza chiita libanesa.
Esta, en suma, es la situación de mayor riesgo mundial de los últimos 20/30 años; y como tal es una convocatoria urgente a una nueva estructura del poder global, centrada en Asia, y fundamentalmente en China, que es el único poder en el mundo capaz de equilibrar a la superpotencia norteamericana, además de restringir y orientar estratégicamente a la otra potencia involucrada, que es la República Islámica de Irán, a la que la Inteligencia estadounidense considera que ya ha adquirido el arma nuclear.
A partir del 7 de octubre, para Israel se aplica con plenitud el principio establecido por André Malraux en “L’Espoir”: “Una vez que se está en Guerra, la moral consiste en vencer”; y en este punto y respecto a este tema es que se resume en noviembre de 2023 la historia del mundo, y del propio Estado de Israel, nacido hace 75 años, el 14 de mayo de 1948.
En una contienda decisiva de alcance mundial como la actual entre Israel y Hamás, hay que dejar de lado las visiones catastróficas por constituir un gasto inútil de energía, y fijar toda la atención en la eficacia de las operaciones: “Yo combato, y luego veo”, afirma Napoleón, lo que tiene como complemento ineludible el apotegma de Clausewitz cuando señala que “…hay un solo error estratégico letal, que es no actuar”.
La sabiduría estratégica es ante todo conocimiento de lo inevitable, lo que en el orden universal de las cosas no puede dejar de suceder. Este ha sido siempre el punto de partida de las auténticas victorias militares, que son las que cambian la historia.
Por eso la visión estratégica descarta la pasión de los aficionados por las consecuencias catastróficas: “La mayor parte de las catástrofes que se prevén, nunca suceden”, dice Churchill en sus “Memorias de Guerra”.
Israel está obligado a actuar y a destruir a Hamás, aunque “…lluevan tormentas y tempestades en los cielos”.
De ahí que el riesgo mayor de la actual situación de Medio Oriente sea el vacío de poder y la creciente parálisis decisional de EE.UU., resultado de la incapacidad de acción del presidente Joe Biden: “La vejez es un naufragio”, le dice De Gaulle a Malraux en la “Hoguera de la Encina”.
Para todo esto hay que creer en una sola cosa, que es el poder inexorable del momento presente."
economia,El lado oscuro del plan platita: la inflación que está escondiendo Massa,https://www.clarin.com/economia//economia/lado-oscuro-plan-platita-inflacion-escondiendo-massa_0_cawUGlMdHv.html,"A dos semanas del balotaje, el ministro candidato Sergio Massa le sumó una capa adicional al plan platita y a la vez postergó actualizaciones de precios que no hacen más que anticipar una mayor expansión de la inflación futura.
Desde las elecciones PASO de agosto en las que el candidato de Unión por la Patria quedó tercero, puso en marcha dos planes simultáneos: el plan platita y el plan freezer.
El plan platita de Massa incluyó en la primera fase un bono de $ 94.000 para trabajadores informales y refuerzos para empleados formales, beneficiarios de planes sociales y jubilados, la devolución del 21% de las compras que se abonen con tarjeta de débito, créditos subsidiados y la eximición de Ganancias a casi un millón de trabajadores. Todo esto supuso un costo de 2,5 billones de pesos, equivalente al 1,3% del PBI.
La semana pasada lanzó una segunda fase de este plan, con planes de jubilación anticipada y nuevos créditos.
El plan freezer incluyó el congelamiento por 90 días las cuotas de las prepagas, del precio de una canasta de medicamentos, de las tarifas de servicios públicos y de los boletos de colectivos, trenes y subtes.
El ""plan freezer"" también incluye el tipo de cambio oficial, que el Gobierno prometió mantener quieto en $ 350 hasta el 15 de noviembre. A esto se suma la reciente renovación de Precios Justos, con un alza de tan solo el 5% contra una inflación que ya lleva tres meses navegando en dos dígitos.
El plan platita financiado con mayor emisión monetaria unido al plan freezer generan un combo de inflación reprimida que se hará visible en los próximos meses.
Si bien para la nafta se aplicó la semana pasada un suba de casi 10%, al mismo tiempo, el Gobierno postergó las aplicaciones de los impuestos a los combustibles hasta febrero de 2024. Ese monto debería actualizarse trimestralmente por la variación de la inflación, pero se viene postergando desde hace más de un año.
Vale la nafta como botón de muestra: el valor del combustible tiene un atraso del 60% en lo que va del año, contra una inflación que ya supera el 120%.
""Que la leche esté 66% más cara que la nafta es sólo un ejemplo de los desequilibrios que deberá atender el próximo gobierno con urgencia"", señala EPyCA Consultores. ""La estabilización requerirá como primer paso un realineamiento de precios: no es posible desacelerar la inflación si aún quedan precios atrasados que deben ser actualizados. Ese fue justamente uno de los errores que cometió Macri cuando puso metas de inflación a la baja mientras actualizaba las atrasadísimas tarifas de servicios públicos"".
Según un relevamiento del economista Fernando Marull, el índice de precios de al consumidor de octubre podría rondar el 9%"", pero para noviembre estima ""un rebote de la inflación al 11%. Para diciembre, cuando efectivamente asuma el nuevo presidente, estimamos una corrección del tipo de cambio oficial y otros descongelamientos, que lleve la inflación mensual a niveles arriba del 25% y termine 2023 en 211%"".
El atraso cambiario también supone un frente conflictivo. Para el economista Camilo Tiscornia “si el Gobierno logra mantener el tipo de cambio oficial en $ 350, ese tipo de cambio ajustado por inflación va a ser más bajo del que hubo en 2001. Esto indica el gravísimo atraso cambiario que está quedando de este gobierno”.
“Todos estamos esperando un ajuste, pero ya se está dando a través de una política económica completamente equivocada, que provoca una cantidad enorme de desequilibrios macroeconómicos” dijo Tiscornia en declaraciones a CNN-Radio.
“Hay inflación reprimida y debería ser más alta de la que tenemos. La consecuencia de eso es lo que estamos viviendo hoy en día. Una brecha altísima del tipo de cambio, una inflación desbocada, actividad económica en caída, controles y trabas de todo tipo y desabastecimiento. Esto es el ajuste a una mala política macroeconómica”, explicó.
Para Marull en 2024, con un Plan de Estabilización que arranque por liberar precios congelados, se empezaría el próximo año con una inflación elevada en el primer semestre de 2024. 
""La inflación reprimida se concentra mayormente en el dólar oficial, naftas y servicios públicos y la estimamos en 52%. No es algo tan elevado para los niveles de inflación con los que ya nos estamos manejando. Si el plan de estabilización es exitoso, la inflación del segundo semestre de 2024 debería ser menor y el año podría cerrar en 140%"", concluye Marull.
Colectivos
A fines de agosto el Gobierno dejó sin efecto el el ajuste por inflación pautado para el transporte en el AMBA para septiembre, como venía ocurriendo desde marzo. Así, la tarifa mínima del colectivo se mantiene en $ 52,96 y la máxima $ 72,61, mientras la del tren, en $25,72 y $ 52,95, según la línea.
Precios justos
El Gobierno dispuso otra renovación Precios Justos con aumentos del 5%. Eso abarca a consumo masivo, indumentaria, calzado, línea blanca, electrodomésticos, celulares y motos
Prepagas
El Gobierno acordó con las prepagas el congelamiento de las cuotas por 90 días para los afiliados con ingresos por debajo de los $ 2.000.000. Para el resto, se mantiene el aumento de la cuota.
Servicios públicos
Las tarifas de luz y gas se encuentran congeladas desde agosto, post PASO. En noviembre podría haber aumentos para los usuarios de ingresos medios y bajos, que pagan menos del 20% del costo de generación
Dólar
El tipo de cambio oficial se mantendrá congelado hasta el 15 de noviembre. Desde ese día se retomarán las micro devaluaciones diarias  -el llamado crawling peg- a un ritmo del 3% mensual, según dijeron en Economía.."
economia,Santos Uribelarrea: una infancia en el palacio Duhau y una fórmula para crecer del campo a las energía renovables,https://www.clarin.com/economia//economia/santos-uribelarrea-infancia-palacio-duhau-formula-crecer-campo-energia-renovables_0_NkUkvScXTI.html,"En un año convulsionado como este 2023 MSU, que resume sus iniciales Manuel Santos de Uribelarrea, es una máquina de hacer proyectos y también dinero presente y futuro.
Nacido en el campo en plena provincia de Santa Fe y único hijo de una madre que se murió demasiado joven, se fue a vivir joven al Palacio Duhau, esa joya arquitectónica en avenida Alvear devenido en hotel y que era la casa de sus abuelos y tíos maternos.
Manuel es la cuarta generación de una familia establecida en la Argentina, con fuerte presencia desde 1860 en el sector agropecuario. Quienes lo conocen bien lo llaman la topadora por su empuje hacia la innovación.
Y él dice que para hacer negocios en una Argentina casi siempre convulsionada hace falta coraje y materia gris.
En 1998, Manuel Santos Uribelarrea,  su hijo mayor, lo convenció de formar MSU Agro que hoy es una de las principales empresas de agronegocios de la región. Su base de operaciones es Villa Cañás, famosa por ser la cuna de Mirta Legrand.
Producen 800 mil toneladas de granos por año en 175 mil hectáreas propias y arrendadas. Y esta fue la piedra basal para la expansión del grupo hacia la energía tradicional y la renovable.
El poderío de su producción agropecuaria es el respaldo para catalizar los otros negocios ante financistas internacionales asustados con el país.
En cuanto al campo, ofrecen servicios de management a inversores institucionales en campos agrícolas en Argentina y Brasil. Y aterrizaron en el mercado de maní: construyen la mayor planta de procesamiento del país, ubicada en el sur de Santa Fe, en la localidad de Lazzerino.
En 2012, MSU empezó a diversificar su canasta y encontró la oportunidad en el área de la generación eléctrica. Desde entonces, lleva invertidos US$ 1.000 millones en el sector energético con siete centrales térmicas, 3 de las cuales son de ciclo combinado, que han logrado uno de los mayores rendimientos operativos del sector.
El Grupo suma una capacidad total instalada de 1,5 GW y está dentro de las 5 principales empresas en el área de energía de la Argentina. La tecnología es de punta y poseen contratos mantenimiento de largo plazo con la estadounidense General Electric. En sus cuatro centrales de ciclo simple tienen contratos de mantenimiento con la alemana Siemens. Y están construyendo en la bonaerense San Pedro otra central térmica.
Pero en 2018 todo fue crisis. Manuel Santos Uribelarrea hijo apareció en los cuadernos de las coimas. Y aunque declaró que sus aportes de dinero habrían sido realizados “para el desarrollo de la campaña electoral correspondiente a 2015”, el daño reputacional quedó.
Las explicaciones le sirvieron. En 2022, MSU desembarcó en las energías renovables y fundó MSU Green Energy. Hoy contabiliza ocho parques solares en construcción, con una capacidad total de 400 MW, una inversión de US$ 300 millones y de esa manera se ha convertido en una de las empresas de energía solar más activas.
Para estos desarrollos se apalancan en contratos de largo plazo para empresas en pleno proceso de descarbonización que necesitan reemplazar sus fuentes de energía por la eólica o solar. Una ley argentina. la 27192, las obliga a acelerar para que el 20% de su fuente de energía sea solar o eólica, con lo que la demanda es casi infinita.
“La limitante para un desarrollo mayor es la posibilidad de evacuación. Falta infraestructura en un escenario donde los costos han caído abruptamente en los últimos 5 años y creció la eficiencia”, sostiene Manuel Santos hijo.
Para los parques solares el socio estratégico es la estadounidense PBB Polisur (Dow), la alemana Volkswagen y la francesa Air Liquide.
Se trata de contratos de venta anticipada de energía por 10 años. Actualmente, tiene un portfolio de proyectos en desarrollo que incluyen proyectos de generación térmica y renovable con una inversión total de otros 1.000 millones de dólares."
economia,Jubilaciones: esta semana se conocerá el aumento de diciembre y la clave pasa por el alcance y el valor de los bonos,https://www.clarin.com/economia//economia/jubilaciones-semana-conocera-aumento-diciembre-clave-pasa-alcance-valor-bonos_0_8GKQMXblp6.html,"Antes del viernes 10, el ministro Sergio Massa y la titular de la ANSeS, Fernanda Raverta deben definir el valor y el alcance de los bonos que deben cobrar los jubilados y pensionados en diciembre 2023, enero y febrero 2024.
Es que ese dia deben anunciar la movilidad previsional para los próximos 3 meses y los cálculos provisorios arrojan un aumento de entre un 23 y 25% versus una inflación en el tercer trimestre del 34,65%. Unos 10 puntos abajo que afecta a 18 millones de personas, entre jubilados, pensionados y beneficiarios de prestaciones sociales.
Por eso, el valor y el alcance de los bonos son claves porque deberían compensar esa pérdida frente a la inflación y además actualizar los valores de los bonos y de los refuerzos que se otorgaron en septiembre, octubre y noviembre.
El primero fue el bono de $ 37.000 para los haberes más bajos (inicialmente de $ 27.000 que por la devaluación del peso en agosto se acrecentó en $ 10.000). Le siguió un refuerzo del PAMI de $ 15.000 para los mayores de 60 años que perciben la jubilación para los meses de septiembre, octubre y noviembre.
También se amplió de $ 4.056 a $ 18.800 el tope reintegro del IVA para los jubilados y pensionados que cobran hasta 6 haberes mínimos. Mientras que por la suba del salario mínimo vital y móvil (SMVM) 1,4 millones de jubilados con haberes mínimos que se jubilaron con 30 años o más de aportes cobraron un plus de $ 20.780 en octubre y cobrarán en noviembre otro plus de $ 32.260.
Por todos estos bonos y refuerzos, la clave pasa por los criterios que tomarán en cuenta Massa y Raverta para definir el valor y el alcance de los bonos para diciembre, enero y febrero de tal manera que los jubilados y pensionados y beneficiarios de las prestaciones sociales no pierdan frente a la inflación ni cobren en términos reales menos que en el trimestre anterior.
Los datos de los últimos 6 años marcan que entre septiembre de 2017 y fines de 2019, la pérdida previsional frente a la inflación fue del 19,5%.
Luego, según ASAP (Asociación Argentina de Presupuesto) “en los 46 meses del periodo que va de junio de 2023 a septiembre de 2019, el haber mínimo en términos constantes cayó - en promedio- un 1% en relación con el nivel de septiembre 2019; mientras que el haber tope del régimen general se redujo en un 15,3% en promedio (en términos constantes)"".
Y agrega: ""En ello incide la aplicación del componente fijo en la movilidad de marzo 2020 y los citados refuerzos o bonos previsionales. Para el haber mínimo, se tiene que en 14 de los 46 meses, la actualización eleva el haber por sobre el de septiembre 2019, mientras que las actualizaciones del citado haber tope realizadas en dicho periodo nunca logran superar el haber en términos constantes de septiembre 2019”.
Si a la caída del 15,3% para los haberes sin bonos se agrega el 19,5% de pérdida entre septiembre 2017 y fines de 2019, resulta una pérdida del 32%.
Por otra parte, ASAP agrega que en “dicho periodo hubo una reducción del 24% en el cociente entre el haber tope y el haber mínimo, que pasó de 7,3 en septiembre de 2019 a 5,6 en junio de 2023”, lo que ilustra el achatamiento de la pirámide previsional.
NE"
