Tema,Título,Enlace,Noticia
sociedad,"Italia, otro destino muy elegido por quienes se van del país: quiénes son y a qué ciudades van",https://www.clarin.com/sociedad//sociedad/italia-destino-elegido-van-pais-ciudades-van_0_9LYAUUY0GE.html,"Muchos de los argentinos que emigran a Italia optan por Roma, la gran ciudad. Otros buscan lugares más tranquilos y con un costo de vida más bajo. Italia es uno de los destinos elegidos por los argentinos a la hora de emigrar. Y cada vez son más los que toman la decisión de dejar su país natal para buscar oportunidades y vivir con algo que, en Argentina, no les resulta familiar: estabilidad.
La mayoría de los entrevistados por Clarín confiesan haberse sentido agobiados por la situación económica y la creciente inseguridad.
Ariela, médica especialista en Pediatría y Oncología, vive en Roma, uno de los lugares más imponentes de Italia y, sobre todo, un buen destino para quienes deciden emigrar con un plan en mente. Se mudó en octubre de 2022 a la gran ciudad junto a su marido, que trabaja en la ONU, y que ya se había establecido cuatro meses antes. Según confiesa, quedarse en el país no era la opción más viable, por eso, empezaron a buscar un destino que les permitiera trabajar a ambos de lo que habían estudiado. “Yo podía homologar mi título acá y a Michele, mi esposo, le salió una oportunidad laboral. Empezó con entrevistas, rindió exámenes y en marzo del año pasado le avisaron que había sido seleccionado”, narra.
Y agrega: “Hay muchísimos argentinos. Nosotros tenemos un grupo de amigos en el que somos seis. Empezamos a juntarnos para el Mundial y después nos afianzamos mucho más. Algunos son economistas y otros abogados que se formaron en otros países y, finalmente, vinieron a vivir a Roma”.
La capital, que guarda historia, brinda paisajes inolvidables y tiene mucha cultura, también tiene un costo de vida más alto, a diferencia de otros pueblos italianos. No obstante, con un trabajo estable, no es algo impensado llegar a fin de mes. “Acá encontramos una estabilidad que por años no tuve en Argentina, sabés que el pan te sale dos euros hoy, mañana y todos los días. Además, con tu sueldo tenés otra calidad de vida, y no es que te das todos los lujos, obviamente, pero sí podés vivir tranquilo, alquilar tu casa, viajar y ahorrar un poco”, comenta.
Mattia es periodista y después de recorrer distintos lugares de Europa, también quiso establecerse en la ciudad romana. Trabaja de forma remota para una empresa francesa y es creador de contenido en una fundación italiana. “La vida acá es muy linda, más allá de que es duro no tener los afectos. Lo bueno es que hay muchos argentinos y todos los miércoles jugamos al fútbol, nos juntamos a comer asado, salimos. La mayoría de mis conocidos están tramitando la ciudadanía”, dice, y confiesa que los vínculos italianos son “muy parecidos a los que tenemos los argentinos”.
Otra de las localidades más nombradas por los entrevistados de Clarín es Torino. “Vine en mayo para ver a unos amigos y después de pasear por distintos lugares, volví acá para establecerme”, relata Daiana, que es contadora y programadora. Como trabaja de forma remota para una empresa de Estados Unidos, tenía la libertad de vivir donde quisiera. No obstante, seguir en Argentina no le resultaba algo factible. “Quería irme porque la economía no está bien y necesitaba otras oportunidades”, confiesa.
Aunque extraña sus afectos, las costumbres y la comida argentina, está muy contenta con la vida que lleva. “Conocí muchas personas que vinieron por lo mismo: a buscar otras oportunidades. Hay muchísimos argentinos y, directamente, hacen fiestas argentinas, como ‘la fiesta del mate’”, cuenta. Daiana todavía no tiene la ciudadanía; sin embargo, logró entregar la carpeta y, en los próximos meses, según cuenta, debería obtenerla. En este sentido, recuerda que muchos de sus conocidos, viajaron directamente para tramitarla ya que, desde Argentina, se vuelve muy tortuoso. “Hay muchas familias que venden todo allá y vienen con sus hijos para empezar otra nueva vida”, comenta sorprendida.
¿Cuáles son las ventajas que ofrece Torino? “Hay mucho intercambio cultural. Además, es una ciudad universitaria, por lo tanto, es una ciudad joven, siempre hay eventos. Es un punto muy estratégico para viajar porque está súper conectado, salen trenes para todos lados y tiene un aeropuerto grande. Es como Roma. De hecho Torino fue la primera capital de Italia por unos años, entonces es muy rico históricamente: tiene muchos museos, castillos, iglesias. Hay historia por dónde te cruces”, enumera Daiana.
“Días antes de emprender mi viaje, sufrí un robo en la puerta de mi casa, esto me hizo pensar en cambiar de realidad”, confiesa Daniela, oriunda de Lanús, que también vive en Torino. Trabaja en un hotel como camarera y aunque le duele extrañar a sus familiares y amigos, dice muy convencida que ya no vive con miedo. “Me sentía muy insegura en Argentina. Nunca es fácil salir de tu país, pero en mi caso, dejé mis comodidades para recibir otras oportunidades; y hoy tengo otra calidad de vida”, señala contenta por la decisión que tomó.
En su caso, el viaje inició para tramitar la ciudadanía y pasear para desconectar: “Todo comenzó con unas simples vacaciones pero luego se convirtieron en una nueva vida. La verdad es que se vive muy bien de este lado, así que en el camino decidí ayudar a quienes quieren hacer sus papeles y tener nuevas oportunidades”, añade.
Santiago llegó junto a su hermano a Italia en plena pandemia: mayo de 2021. “Vinimos a hacer la ciudadanía porque sabía que en mi país era muy difícil. Estuve viviendo en Perugia y ahora me mudo a Torino porque mi novia, que es médica, empieza la residencia”, cuenta. Según relata, el trámite que todos los argentinos anhelan, también es difícil en Italia. “Hay mucha burocracia”, dice. No obstante, la consiguió.
“Torino es una ciudad grande, pero no exageradamente. A mí, al ser de Luján, me gusta el ritmo de vida un poco más tranquilo. Podés hacer todo en bici y estas re cerca de todos lados, hay muchos parques verdes grandes y el río Po en el medio de la ciudad”.
“Al menos cuatro años más, me voy a quedar acá. Si las cosas en Argentina mejoraran, si cambiara el gobierno y todo fuera estable, me volvería”, confiesa Santiago.
En la región central de Italia también existe una opción elegida con frecuencia por quienes buscan emigrar: Le Marche, o Las Marcas. Juan es uno de los que apostó por Civitanova Marche, un lugar tranquilo sobre la costa del mar Adriático. Su relato es el de alguien que se cansó de una forma de vida y que, ahora, disfruta lo que siempre quiso.
“Vine en 2021 junto a mi esposa y a mi hija. Tramité durante dos años la ciudadanía y ni bien la obtuve, decidimos irnos. Los dos teníamos buenos trabajos y una casa en Recoleta, a cuatro cuadras de un shopping, pero nos cansamos de vivir situaciones muy feas. A mí me asaltaron tres veces. Además, era desgastante tener que mirar para todos lados cada vez que ibas a entrar a tu casa”, cuenta sobre sus años en Argentina.
“Me gusta saber que mi mujer puede ir y venir en tren a cualquier hora y podemos estar tranquilos con eso. Quiero estar así, sabiendo que puedo llevar a mi hijo al colegio y no pasa nada. Acá incluso si se te cae la billetera, la dejan apoyada en algún lado para que la veas cuando la volvés a buscar”, relata quien al poco tiempo de desembarcar en su nuevo hogar, consiguió trabajo como gerente de una fábrica.Y agrega: “Es un lugar verde muy bello frente a las costas de Croacia, tiene mar y montaña conectados a pocos minutos. Y principalmente, es muy tranquilo”.
Agustina está en la misma región, pero en la localidad de Grottammare, desde hace ocho meses. ¿Por qué eligió este destino? “Aparecían muchos videos y grupos de Facebook de argentinos viviendo acá y nos daba confianza. Es una zona de ciudades costeras con turismo de verano, tiene mar y montañas. Había similitud con Miramar, donde viví siempre en Argentina por la playa y eso te ayuda cuando te vas a vivir a otro país”, contesta.
Ella también notó un gran cambio en su calidad de vida tras optar por un lugar “tranquilo y seguro”. “Lo que tengo acá en poco tiempo trabajando, nunca lo puedo tener en mi país”, añade. Por este motivo, advierte que son muchos los que también escogen la región para empezar de nuevo: “Te diría que hay cientos de argentinos alojados en diferentes ciudades y pueblitos. Muchos vienen a hacerse la ciudadanía, algunos se quedan y otros se van a otro país”.
La realidad es que Italia recibe cada vez más argentinos. En cada rincón, existe un grupo de gente -mayor o menor dependiendo del lugar- que decidió desembarcar en la tierra de sus antepasados, o que simplemente, lo eligió porque ofrece otra calidad de vida.
SC"
sociedad,"La Marcha del Orgullo y un fuerte reclamo por la democracia: ""Que no nos saquen nuestros derechos""  ",https://www.clarin.com/sociedad//sociedad/marcha-orgullo-fuerte-reclamo-democracia-saquen-derechos_0_aJxi8yzO2U.html,"La que está subida a los tacos blancos con alas de ángel es Belén Salas, la mujer que pensó que “jamás iba a llegar a los 28 años” y que desde hace cuatro meses trabaja como seguridad en la Cámara de Diputados nacional, gracias a la Ley de Cupo Trans. Se emociona. “Es un orgullo. Yo trabajé en la calle hasta los 22, pensando que mi vida iba a terminar así, en la prostitución”, explica.
Hay clima de fiesta entre las personas que llenaron este sábado el centro porteño, para participar de la 32 Marcha del Orgullo. En el camión del bachillerato popular Travesti- Trans Mocha Celis, todavía estacionado en Diagonal Norte, un grupo de chicos pide sacar una foto a Belén. El sol acompaña y miles aprovechan para sacarse abrigos y disfrutar de los brillos, las transparencias y la música bolichera.
“Estamos con más unión, con más fuerzas, más empoderadas que nunca y con ganas de que no nos saquen nuestros derechos”, afirma Belén y apunta que ahora toca pensar en las nuevas generaciones: “Porque en definitiva es eso, ¿no?. Defender los derechos hoy es saber que tus hijos, tal como me pasó a mí, van a tener una alternativa, que la prostitución no va a ser el único camino. Y nosotras hoy estamos dando ese ejemplo”.
Desde las 15, miles de personas desfilaron, bailando en la calle y carrozas por la Avenida de Mayo, desde Plaza de Mayo al Congreso. La marca Jean Paul Gaultier volvió a participar con la presencia de Moria Casán y Florencia de la V, en el micro que usó la Selección Argentina para desfilar por Buenos Aires tras conseguir la Copa, pero ploteado con mensajes con la diversidad. 
La consigna principal de la marcha este año fue “Orgullo es democracia. ¡Reparación Histórica Travesti Trans ya!”, en reclamo por una ley dirigida a aquellas adultas mayores sobrevivientes de la violencia institucional ejercida por el Estado por motivo de su identidad de género.
40 años de democracia
Este Orgullo llegó en coincidencia con los casi 40 años de democracia y a dos semanas de un balotaje, en el que los candidatos plantean visiones opuestas respecto a la política de diversidad y género. En ese sentido, la comisión organizadora –integrada por 67 organizaciones- hizo un llamado “a defender los derechos humanos y la institucionalidad lograda en materia de géneros y diversidad y a fortalecer la democracia frente al asedio de los discursos negacionistas y de odio de la extrema derecha”.
Agachado sobre su paño de mercadería, Nahuel del emprendimiento de “arte y lucha” @larevoltosapin, cuenta que lo que más se llevó esta marcha fueron los prendedores con forma de corazón con los colores de la bandera lgbt y uno que recuerda la frase del “gatito mimoso” de Myriam Bregman, donde se muestra a un “michi” de ojos grandes –estilo el Gato con botas de Shrek- con la frase “Milei nunca” en letras coloridas.
El arcoíris inflable marca como en anteriores marchas el inicio del recorrido para los que desfilan. “Cuando el odio avanza, el orgullo no retrocede”, “Si me querés quereme trans”, “Dónde está Tehuel” y “No queremos que tus hijos cis sean trans, queremos que tus hijos trans sobrevivan”, se lee entre los carteles.
Federico es el varón trans que levanta el último de esos mensajes en una cartón que trajo desde el partido de San Fernando. Dice que le gusta el ambiente, que no se hubiera animado a usar una remera corta en su barrio, pero que acá se siente en libertad de hacerlo. “Nunca fui discriminado, porque mi familia y mis amigos siempre me aceptaron, pero es como que el trato de quienes no son de tu círculo siempre es distinto”, explica y recuerda que “el tiempo para vivir es hoy o nunca, le diría a todos eso, que vivan”.
Natacha, de 31 años, llegó con su hija de 8 para apoyar “la libertad del amor”. “Hay mucho miedo e incertidumbre por lo que va a pasar después de octubre. Pero no perdemos las esperanzas de que gane un gobierno popular, porque aunque no sea el ideal para muchos, siempre es preferible a alguien que viene a arrasar con todo”, afirma.
Desde el mediodía, las organizaciones se concentraron con stands en la plaza frente a la Casa Rosada. AHF Argentina contó con uno en el que se brindó información sobre prevención de Infecciones de Transmisión Sexual, la importancia de realizarse la prueba de VIH, y promocionará su Centro Comunitario de Salud Sexual. “40 años de democracia con VIH sin cura”, se lee en una pintada sobre la calle.
Desde la Comunidad Homosexual Argentina (CHA), una de las organizadoras históricas de la marcha, la activista lesbiana Maria Laura Oliver expresó: “Celebramos 40 años de democracia y con ella la ampliación de derechos y libertades, las leyes de matrimonio igualitario e identidad de género. Por sobre todo celebramos el orgullo y a nuestra comunidad LGBTINB+ y lo hacemos bailando en la calle y reclamando, esta vez la defensa de los derechos logrados y la Reparación Histórica travestis y trans”.
Por su parte, el presidente de SIGLA, Maximiliano Lois recordó que “esta 32 marcha del orgullo se realiza en el contexto de una elección presidencial trascendental donde se debaten dos modelos de país: uno inclusivo, con respeto a los derechos reconocidos a nuestra comunidad LGBTINB+ - y con la expectativa de conseguir más; y otro modelo excluyente y neofascista que intenta gestionar todo desde la fría e inhumana lógica del mercado, con reiterados ataques a nuestro colectivo”.
Por su parte Martín Canevaro, por 100% Diversidad y Derechos sostuvo que ""La masividad de la marcha, que ya se realiza en todas las ciudades del país, es la ratificación de que a 40 años de democracia la sociedad argentina sigue abrazando las ideas de igualdad y diversidad, por eso no pasará la avanzada anti derechos. Estamos alertas, pero tenemos la convicción de que los consensos democráticos saldrán fortalecidos. Orgullo si, ¡Milei no!""
Glimer, de 25 años, llegó a Buenos Aires desde Venezuela hace 6 años y se define como “una persona orgullosamente homosexual y de acuario”. Se ríe y dice que es “importante defender los derechos conseguidos en la Argentina”, porque marca el “ejemplo” para toda América Latina.
“Yo celebro el orgullo porque me parece importante siempre visibilizar que estamos presentes y que todos somos humanos, y eso se ve y se muestra a todo el mundo, porque no en todas partes están tan avanzados”, recuerda.
MI"
sociedad,"El chico de pueblo que cumplió el sueño de meterse en la ""discusión global"" ",https://www.clarin.com/sociedad//sociedad/chico-pueblo-cumplio-sueno-meterse-discusion-global_0_be3WxW4EyD.html,"""Es un sueño cumplido"", define Gerónimo Bukosky, de 19 años. Hace mucho que el adolescente criado en un pueblo de solo 5 mil habitantes practica la tarea diplomática en modelos para estudiantes de la ONU, pero esta semana, por primera vez, el ejercicio de la palabra dejó de ser un simulacro.
Tras una colecta solidaria con fuerte apoyo de su pueblo, Hilario Ascasubi, a 750 kilómetros de la ciudad de Buenos Aires, y de decenas de presentaciones para juntar sponsors, Bukosky pudo presentarse como único argentino y también único sudamericano en el IV Foro de la Juventud, un evento de la Conferencia de las Naciones Unidas sobre Comercio y Desarrollo (UNCTAD, por sus siglas en inglés) que se desarrolla en el marco del Foro Mundial de Inversiones en Abu Dhabi, en los Emiratos Árabes.
La experiencia, dirá Bukosky, fue emocionante en más de un área. Fue la primera vez en hacer un “viaje largo” solo –el vuelo duró 19 horas-, un enorme impulso a su carrera profesional –se mudó a la capital para comenzar la Licenciatura en Gobierno y Relaciones Internacionales de la Universidad Argentina de la Empresa (UADE)-, y sobre todo la gratificación de poder expresar lo que vive la juventud con discapacidad en la Argentina y disertar acerca de soluciones innovadoras.
“En América Latina, sólo el 20% de los niños con discapacidad está escolarizado. El no acceder a la escuela luego dificulta en la vida adulta el acceso a un trabajo digno”, detalló Gerónimo en perfecto inglés ante un auditorio repleto de jóvenes de todo el mundo.
Desde Abu Dhabi, el joven se explaya por WhatsApp en diálogo con Clarín: “En la Argentina, el 91% de las personas con discapacidad se encuentra desempleada. Ese 91% no son números, son personas. Entonces, es acá donde debemos poner el foco a la hora de hablar de potenciar el factor humano. Si dejamos personas fuera, estaríamos atentando contra la agenda 2030 que promueve la ONU”.
La elección de las palabras, así como las figuras retóricas que usa al hablar, no salen improvisadas. Fueron más de 15 simulacros ONU los que hizo a lo largo de la secundaria, emulando representar la voz de distintas naciones en los congresos que se forman para opinar.
Están los Consejos de Seguridad, la más picante de las asambleas, en la que los alumnos hacen de funcionarios de las grandes potencias mundiales para intentar dirimir pacíficamente conflictos internacionales, y también las asambleas especializadas en distintas temáticas en la que los representantes intentan influir en la agenda internacional.
Gerónimo actuó de representante de países como Jordania, Irlanda, Trinidad y Tobago, Alemania e Israel; pesos pesados y también países de menor peso geopolítico.
Dice que la “culpable” de este interés en el mundo diplomático fue una profesora de Geografía, Rocío Sgaravato, y que los modelos le sirvieron para enriquecer su mirada del mundo, sacarse un poco de la vergüenza y adquirir “mayor oralidad"".
¿Cómo la pasó en la ONU real? “Tuve que exponer ante unas 100 personas en inglés, que me manejo bastante bien, aunque no deja de ser otro idioma, y responder preguntas. Los nervios siempre están, más que nada cuando te toca exponer en otro idioma y responder preguntas, que no sabés por dónde pueden venir, pero para mí es un sueño que cumplí”, cuenta después del primer día de encuentro.
El objetivo ahora, para el resto del evento, será que la información que aportó quede plasmada en la resolución final, un documento que se redacta en conjunto y luego se somete a votación para delinear las necesidades y estrategias que sirven de modelo a trabajar en cada país. En criollo, si te metés en el documento, hiciste un gol para tu país.
Gerónimo asegura que lo que más satisfacción le da de estar en Abu Dhabi es poder aportar a la población joven con discapacidad. El tema discapacidad moviliza a Gerónimo desde que conoció a Fernando, un amigo médico de su padre, quien tras un accidente con su moto, quedó hemipléjico. ""Empecé a ver la cantidad de barreras y obstáculos que él debía sortear, como no poder subir a todos los transportes públicos o acceder a determinadas playas”, explica.
Desde la Federación de Estudiantes Secundarios (FES), que integraba en la secundaria en Hilario Ascasubi, ya empezó a trabajar políticas estudiantiles vinculadas a la discapacidad y hoy sigue encarando el tema como voluntario y promotor de derechos de personas con síndrome de Down, trastornos del espectro autista, problemas visuales, auditivos y motrices desde la Fundación Comparlante, una organización sin fines de lucro con estatus consultivo en Naciones Unidas.
Uno de los puntos debatidos en el foro es el papel de las nuevas tecnologías, como la inteligencia artificial, en la promoción de los derechos de las personas con discapacidad: “Desde la Fundación Comparlante creemos y apostamos al potencial de las tecnologías. Sabemos que si se implementan de manera correcta pueden ayudarnos a combatir las brechas con las que convivimos los jóvenes, creando entornos que potencien las capacidades de todo ser humano”, afirmó el ascasubense.
El camino para llegar a la ONU
Cuando Gerónimo recibió en julio la noticia de su selección entre 250 jóvenes de todo el mundo para asistir al Foro de la Juventud, la alegría fue total. Sin embargo, la pregunta era cómo iba a sortear todas las barreras económicas para viajar a Medio Oriente, un trayecto que saben los que fueron al Mundial de Qatar no es nada sencillo desde la Argentina.
El pasaje surgió gracias a una gestión realizada por la Embajada Argentina en los Emiratos Árabes, que logró que la compañía aérea Emirates le facilitara su pasaje de avión desde Buenos Aires. “Cuando nos enteramos, fue realmente un respiro”, cuenta Gerónimo.
A su vez, desde Comparlante, la ONG que Bukosky integra, impulsaron una colecta solidaria para poder solventar la estadía del joven. Y ahí fue clave el apoyo de su pueblo, Hilario Ascasubi, dentro del partido de Villarino, a 100 kilómetros de Bahía Blanca, pero también de empresas como Palo Verde y Corelite Composites que ofrecieron sponsoreo a través de la Fundación Comparlante.
“Ser parte de la discusión global es increíble”, expresa el adolescente y aclara: “No lo tomo tanto por el lado de mi experiencia personal, sino por la oportunidad de que Argentina también tenga una voz acá, en cuanto a juventud, en cuanto a personas con discapacidad”."
