Tema,Título,Enlace,Noticia
politica,"Consejos de Mauricio Macri a Javier Milei para aplastar a La Cámpora,  y las peleas por copar su gabinete",https://www.clarin.com/politica//politica/consejos-mauricio-macri-javier-milei-aplastar-campora-peleas-copar-gabinete_0_v4r7lkLBwo.html,"A las nueve de la mañana de ayer, Javier Milei por fin pudo cortar su celular para abordar lo que tanto anhelaba. La taza de té caliente que tomó a poco de despertar. Detesta el té frío. Pero el teléfono sonaba y sonaba y le dio prioridad. Lo esperaba un día largo y difícil. 
Como todos los que vendrán hasta la noche del 19 de noviembre. El balotaje. El día en que se sabrá si es será electo Presidente de la Nación. O si lo será su ahora su única rival en los comicios, el actual ministro de Economía, Sergio Massa. Su nuevo objetivo a demoler. Milei volvía ayer a las calles, a las caravanas proselitistas después de las elecciones generales donde Massa le sacó seis puntos de ventaja. 
Pero, sobre todo, volvería a verse con su militancia tras recibir el apoyo oficial de Mauricio Macri, Patricia Bullrich, y una sector del PRO. La coalición Juntos por el Cambio (JxC) se fracturó por él. ¿Volverá a ser Milei el mismo Milei de siempre? ¿O el ascenso de Macri, el avance del PRO sobre su campaña y los intentos de sus nuevos ""socios"" por imponerle sus ideas y copar parte de su Gabinete cambiarán la esencia del candidato libertario?
En la reunión con “El Presidente”, como llama Milei a Macri en persona, no se discutió un reparto de cargos en el Gabinete. Pero Macri le aconsejó lo que debería hacer en organismos “como el PAMI, el ANSES, en todo el sector que maneja la Energía, en el ministerio de Justicia, Defensa, o la AFI (Agencia de Inteligencia). Vas a asumir y La Cámpora te va a querer boicotear como me lo hicieron a mí. Vas a tener que hacer algo con eso, Javier. Y nosotros podemos ayudarte. Yo tengo la experiencia de haber pasado por todo aquello”, le soltó Macri, diciéndole, sin decir, cuál cree que son los entes públicos más sensibles para él.
Milei no miente cuando afirma que no hizo un “pacto” con Macri. Porque fue así como se lo dijo aquella noche de la polémica “al Presidente”. Según fuentes que participaron de ese encuentro, Milei le explicó a Macri que no era conveniente para su performance electoral que se llegue a un acuerdo explícito de gobierno entre hasta que él ganase o no las elecciones: “Un acuerdo así nos complicaría a todos. Pero, Señor Presidente, por supuesto que vamos a necesitar de dirigentes con experiencia en la gestión”, concedió Milei. Su hermana, Karina, escuchaba a su lado, siempre hablando poco, pero oyéndolo todo.
El manejo del Milei mediático fue uno de los principales ejes de ese largo diálogo al que se fueron sumando dirigentes en la casa de Macri en Acassuso, y que duró varias horas. Quedó implícito que, de vencer en los comicios, habrá dirigentes del PRO que se sumarán al Gabinete.
El estratega de la campaña del libertario, el escribano Santiago Caputo (un familiar lejano del amigo de Macri, Nicolás Caputo, con quien ni siquiera se ve a pesar del lazo de sangre), coincidió con el análisis de Diego Santilli, por ejemplo, que propuso que Milei deje por un tiempo de ir a los medios audiovisuales para achicar el margen de errores que podrían cometerse.
“Basta de políticos nuestros hablando por todos lados”, pidieron del lado de Macri, pero aludiendo a los libertarios también.
Milei tuvo una primera semana tras elecciones que le trajo problemas tras exponerse de nuevo a la tevé. Se puso nervioso en una entrevista con Esteban Trebuq en A24. Sus rivales aprovecharon para castigarlo e intentar instalar que sufre de inestabilidad emocional. Milei explicó qué le había pasado en un segundo reportaje con Luis Majul en LN+.
Desde entonces solo se comunicó vía redes sociales. También para responder a críticas de Massa.
Pero varias declaraciones de quien es su vocera y posible Canciller, la economista Diana Mondino, sobre todo respecto al “mercado de órganos” que incluyó LLA en su plataforma electoral, y sobre el “matrimonio igualitario”, generaron críticas entre los propios asesores de Milei y Macri y el PRO.
Massa volvía a tener con qué alimentar su tesis sobre su rival frente a la militancia del peronismo y los ""independientes"".
El viernes, Milei salió feliz de la que quizás haya sido la entrevista más extraña que concedió desde que es candidato. Habló con la ex vedete Amalia “Yuyito” González, por el canal Magazine. Ella lo elogió porque era “mas bonito"" en persona. Debatieron sobre espiritualidad, lujuria, codicia. ""Es humano"", celebró ""Yuyito"".
Milei acotará ahora sus salidas en los medios. Le dará una entrevista a Jaime Bayly, el magnífico periodista y escritor que transmite su programa desde Miami al mundo. Y luego tiene agendado otro reportaje televisivo más. Al menos hasta ahora.
Cambió todo en la campaña de Milei. “Nos acostumbramos a que se hablara siempre de nuestras ideas, y ahora nos enfrentamos a otra cosa”, dijo a Clarín uno de sus principales asesores.
Resta por saldar las internas, tanto en LLA como en el que PRO, generadas por su acercamiento con Macri.
Por ahora, lo único concreto entre ambos espacios es la organización conjunta de la fiscalización de la elección en todo el país.
Tras las recorridas y caravana callejeras de ayer, el balance que hicieron ambos ""socio"" ante el balotaje fue bueno.
Milei recorrió San Isidro y Tres de Febrero. Miles de personas volvieron a vivarlo. En la Plaza del Avión, Ciudad Jardín, Palomar, Milei dio un discurso subido a un camión como escenario. Una pantalla detrás suyo decía Milei 2023 y debajo el nuevo slogan de esta etapa: ""La única solución"". El libertario agitó a su público como siempre. Saludó: ""¡Hola a tooodos!"", y entonces cantó: ""Yo soy el Rey/ De un mundo perdido/ Soy el Rey, te destrozaré/ Toda la casta es de mi apetito"". Y tres veces gritó: ""¡Viva la libertad carajo"". Y tres veces le devolvieron el eco: ""¡Vida la libertad carajo!"". 
Milei estaba acompañado por su candidata a vice, Victoria Villarroel, la ex candidata a gobernadora bonaerense, Carolina Píparo; la diputada electa Marcela Pagano y el ex candidato a jefe porteño Ramiro Marra. Nadie del PRO. Nadie cercano a Macri. Milei no pidió esta vez que la militancia asustara a la dirigencia tradicional al grito del ""¡Que de vayan todos!"". Habló pausado. Contó la historia de la Batalla de Caseros, librada entre Urquiza y Rosas en esas tierras. Y reveló que vivió toda su vida en el distrito que gobierna Diego Valenzuela, de JxC. El jefe comunal había chateado con él para garantizarle que en su territorio no habría problemas. La seguridad del acto estaba cubierta. Son viejos conocidos: fueron juntos a la Facultad.
Milei se dedicará ahora al proselitismo, a la campaña diseñada por Caputo. Habrá recorridos callejeras en todo el país.
La motosierra, símbolo del ajuste del Estado, no volverá a encenderse.
Además de enfrentar a Massa, Milei sabe que seguirán criticándolo desde la cúpulas de la UCR, la Coalición Cívica de Elisa Carrió, y que nunca jamás contará con el apoyo de Horacio Rodríguez Larreta.
La noche en la que se reunió en secreto con Macri, y otros dirigentes del PRO y de La Libertad Avanza (LLA), “El Presidente” pidió varias veces que reprimiera su habitual carácter confrontativo, hablar gritando, o el enojo como instrumento de comunicación. Milei sigue habló varias veces más con Macri. Esa cercanía genera, en ciertos sectores de LLA, fastidio.
Desde que se reunió con Macri, Milei hasta debió ratificar que cumplirá dos de sus promesas más emblemáticas. La dolarización y la eliminación del Banco Central.
Se prepara ahora para el debate final con Massa. Sabe que el candidato oficialista buscará ponerlo nervioso, sacarlo de su eje.
Desde el PRO le advirtieron que, además, el oficialismo no movió el feriado del 20 de noviembre, el día siguiente a la elección, porque Massa analizó que muchos votantes del PRO-mileísta viajarán a disitintos puntos turísticos. “Nosotros alguna vez hicimos lo mismo y perdimos tres puntos de votos”, se lamenta uno de los fundadores del partido de Macri.
Los actos de ayer, se dijo, serán tomados como tests para conocer qué pasa entre los votantes “orignales” de Milei tras su acuerdo con Macri.
“Estaba más moderado, es verdad. Pero nadie, y hablé con un montón de personas, se preguntaba qué pasa con Javier después de que se acercó Macri. A mí no me importa nada de eso. Le le creo todo”, le dijo a Clarín Sergio Grosso, vecino de Ciudad Jardín, presente en el acto, libertario total.
Pero el acuerdo con Macri sigue su dinámica propia entre las cúpulas dirigenciales de de LLA y el PRO.
Uno de los interlocutores más antiguos que Milei tiene con Macri, Alberto Benegas Lynch, lo dejó claró tras un escrito que difundió en las redes: “No traten de domar a Javier Milei”.
Los enemigos podrían ser ahora no solo los rivales electorales, si no también los descontentos de la interna propia.
Macri se reunió esta semana, a solas, con la candidata a vice de LLA, Victoria Villarroel. “Solo por diplomacia”, minimizaron cerca del libertario. ¿Será?
Karina Milei, la hermana de Javier, continuará siendo la absoluta jefa de LLA.
La noche que se vieron con Macri ella vive en el mismo complejo de edificios de Vicente López que ella. “Por eso decían que nos veíamos nosotros. En realidad vos ibas a ver a tu familia”.
Milei dice estar tranquilo a pesar de todo. La explicación que da a sus íntimos es particular: “Mi vida fue una mierda, man. Muy dura. Mi papá me volvía loco después de cada examen. Me pegaba de chico. Cuando era arquero tenía atás toda una hinchada insultándome. Lo que te quiero decir es ésto: trabajo mejor bajo presión. Yo me preocuparía más si estuviera en una campaña tranquila y no como ésta”.
Milei es Milei.
Macri es Macri.
La fusión de dos personalidades fuertes empieza a verse reflejada en una elección donde el resultado será a todo o nada. La pelea final por el poder total."
politica,"Javier Milei promete ""no tener operadores judiciales, ni valijeros y cárceles semiprivadas""",https://www.clarin.com/politica//politica/javier-milei-promete-tener-operadores-judiciales-valijeros-carceles-semiprivadas_0_7vCcCDqN62.html,"Mariano Cúneo Libarona conocía a Javier Milei de hacía diez años atrás cuando trabaja para el Grupo América de Eduardo Eurnekian y hace unas semanas lo convocó para sumarse a su equipo. Al principio, Cúneo dudó porque está al frente de uno de los estudios de abogados penalistas más conocidos de Buenos Aires. Cuando aceptó, Milei le dijo “yo me voy a ocupar de achicar el Estado y de la Economía y vos maneja la Libertad. Quiero una Justicia independiente, transparente, libre de presiones y eficiente. Yo tengo el culo limpio, no como otros”.
Ahora que aceptó ser el referente judicial de Milei, Cúneo dio su primera entrevista a Clarín y prometió que si Milei gana y su plan de reforma judicial se pone en práctica “se acabarán los operadores judiciales, las “mesas judiciales” y las “valijas” en tribunales. Igualdad para todos los abogados y fallos basados en fundamentos”.
Cúneo dirige un equipo de abogados libertarios que integran Diego Guerendiain - ex funcionario judicial y profesor de Derecho, Juan Ignacio Petra Cremaschi -especialista en derecho Comercial-, tres notables letrados penalistas y dos ex jueces, entre otros, que están preparando una serie de proyectos para implementar en Justicia en caso de que Milei le gane a Sergio Masa en el balotaje. Antes de aceptar, Cúneo corrió al operador judicial Guillermo Scarcella que había intentado acercarse al entorno del candidato libertario.
Emocionado porque lo había llamado por teléfono el ex juez Enrique Posse -su primer secretario en tribunales-, para felicitarlo por su rol de asesor clave del candidato de La Libertad Avanza (LLA), Cúneo respondió preguntas sobre esos proyectos y la crítica situación de la Justicia.
Al empezar la entrevista en su estudio de avenida Libertador y Cerrito, Cúneo Libarona dijo que “es una vergüenza el juicio político que el kirchnerismo lleva adelante contra la Corte y, además, es inaceptable”. Como también “es inaceptable”, dijo, que la ex juez Ana Figueroa dejada cesante por la Corte quiera ahora volver a la Cámara Federal de Casación Penal. “Hay que reaccionar y dejar de aceptar como cotidiano que haya tantas vacantes, que los juicios tarden hasta 26 años o que presionen a los jueces”, agregó.
“Milei me encomendó redactar un proyecto para darle autarquía financiar a la Corte. Actualmente, todo aumento de las partidas presupuestarias tienen que tener el visto bueno del jefe de gabinete lo que se ha convertido en un mecanismo más de presión y extorsión sobre la Corte”, explicó. “La independencia judicial, en otras palabras, es el sueldo del juez y no que te amenacen con bajarte el sueldo o cambiarte la jubilación, sino la Justicia queda supeditada al gobierno de turno”, precisó.
Como “me dijo el presidente de un colegio de abogados, obran con dolo para destruir el poder judicial”, puso de manifestó.
El asesor de Mile es hijo del famoso ex fiscal de la cámara de apelaciones porteña Mariano Cúneo Libarona y es uno de los abogados penalistas que más conoce los tribunales. Se recibió de abogado en la Universidad del Museo Social Argentino y luego de Doctor en la Universidad del Salvador (2018) por su Tesis Doctoral “La omisión punible”. Cursó estudios de Derecho Penal en las Universidades: Pompeu Fabra de Barcelona, Universidad de California y Gottingen, Alemania. Es autor de varios libros de Derecho. Ingresó en el Poder Judicial de la Nación en 1981, pasando por todos los escalafones, y en 1984, con 23 años, fue designado secretario letrado. Luego renunció y se dedicó a ejercer la profesión.
Actualmente es Decano de la Facultad de Derecho de la Universidad del Museo Social Argentino, donde además es profesor titular de la materia derecho penal, y profesor en la especialización de derecho procesal penal. También es miembro titular del jurado convocado por el Consejo de la Magistratura de la Nación para distintos concursos de jueces. En 1996, fue el abogado de Guillermo Cóppola en el escándalo del jarrón con cocaína que achacaban a Diego Maradona. Participó de programas de TV como “Animales Sueltos” Adelantó que si es nombrado en un eventual gobierno de Milei, renunciará a su estudio jurídico que quedará en manos de sus hermanos.
En su estudio de Retiro tiene una foto de su padre, otra con el Papa Francisco y exhibe una tercera con el ex presidente de EE.UU. John Kennedy.
Cúneo se presenta como “asesor” de Milei pero el candidato libertario ya dijo que “es altamente probable” que sea su eventual ministro de Justicia si gana la segunda vuelta. Cúneo dio una entrevista, en cambio, el referente judicial del candidato presidencial del oficialismo Sergio Massa, Ramiro Gutiérrez, no contestó los llamados de Clarín para conocer sus propuestas.
“Luego de 40 años con la Justicia, en tribunales como pinche o ejerciendo la profesión, la Justicia es para mí como una novia que han dañado y hay que ayudarla”, dijo. “No puede ser que jueces y fiscales tengan vergüenza de circular con las chapas blancas en sus autos o sean abucheados en restaurantes. Hay que recuperar el prestigio que la Justicia tenía antes de los años 90. Cuando mi papá llegaba a mi colegio con su auto viejo y la chapa blanca era un orgullo. Era el Señor Fiscal”, contó.
“Hay muy buenos jueces que tienen el pliego para ascender frenado en el Senado por cuestiones políticos y otros que atienden tres juzgados a la vez por las vacantes. No dan abasto”, subrayó al hacer un diagnóstico de la Justicia.
Cuando se le preguntó cómo pondrá en marcha estas reformas sin una mayoría propia en el Congreso, contestó que “propondremos que primero en el Consejo de la Magistratura se hagan los concursos para elegir los mejores candidatos a jueces antes de que estén las vacantes. Es para dar previsibilidad”.
Además, “impulsaremos que los consejeros sean de dedicación exclusiva pero siempre respetando el equilibrio de representantes del que habla la Constitución Nacional”. Todo respetando el “equilibrio” de los representantes de los abogados, legisladores, gobiernos y académicos que repuso el fallo de la Corte de diciembre de 2021 y cómo “lo pensaron Alfonsín y Menem caminando por Olivos” en 1994.
“Luego convenceremos a los senadores que se necesita cubrir los casi dos tercios de vacantes con los mejores candidatos, sin amiguismos ni apoyos políticos para enfrentar a la corrupción, el narcotráfico y los crímenes comunes que nos obligan a vivir en un clima de inseguridad constante”. Para Cúneo si bien se hicieron “145 reformas al Código Penal, no puede ser que delitos contra el Estado (la corrupción) tengan penas bajas pese la gravedad del daño que ocasionaron”.
Sobre la cobertura de una vacante en la Corte Suprema y el nombramiento de un nuevo Procurador General de la Nación, Cúneo Libarona reveló que “ya le propuse a Milei una candidata y un candidato que tienen los mejores antecedentes, que fueron chequeados y no son mis amigos. Pero sus nombres se mantendrán en reserva para no desgastarlos”. 
Para Cúneo será prioridad tener un nuevo jefe de fiscales porque “será el que defina la política criminal en la cual la prioridad tiene que pasar a ser la víctima y no el victimario”, planteó, en contra de la doctrina hipergarantista de Eugenio Zaffaroni que abrazó el kirchnerismo.
Adelantó que Milei aceptó que el futuro titular de la Oficina Anticorrupción (OA) surja “de una terna de candidatos que elija la oposición en el Congreso porque el control de nuestro gobierno tendrá que hacerlo una figura independiente”. “No puede ser que la OA sea usada en la guerra política entre gobiernos o sea, como ahora, prácticamente desarmada”, añadió. Si bien se superpone, dijo, con la Procuraduría de Investigaciones Administrativas (PIA) que dirige Sergio Rodríguez que “investiga mucho pero no le dan bola”, se replantearán sus funciones.
También pidió que la Unidad de Información Financiera (UIF) “se ponga a disposición de la Justicia” y vuelva a participar activamente de la cooperación internacional en la materia, a través del Grupo de Acción Financiera Internacional (GAFI). “Ya tengo dos genios en lavado de dinero para proponer como director y subdirector para que vayan a la UIF”, adelantó y se excusó de dar sus nombres. Y pidió que los ocho representantes de otros organismos que asesoran a la UIF “pasen a trabajar” o renuncien.
Para agilizar los juicios por corrupción propondrá una ley de “juicio rápido y plazo razonable partiendo del principio de que ningún juicio puede durar más del doble de la eventual condena que tiene el delito. Por ejemplo, un hurto tiene dos años, entonces tiene cuatro años de plazo”. Y si un juez se excede en este plazo, “será controlado por su superior y sancionado”. También se buscará poner “límites” a los recursos de apelaciones de las defensas. “No es Justicia una condena 24 años después de los hechos”, enfatizó.
De la misma forma el juicio por jurados. También prepara cambios para agilizar los juicios laborales y los concursos y quiebras de las empresas a fin de “facilitar la inversión”. “La Inspección General de la Justicia debe volver a ser un organismo de registro y no “legislativo”, como ahora”, adelantó.
Otra de las primeras medidas que tomaría será poner en práctica en todo el país el nuevo Código Procesal Penal que establece el sistema acusatorio en el cual la investigación pasará de los jueces a estar en manos de los fiscales. Ahora solo rige en Jujuy y Salta.
Al preguntársele si es cierto que Milei la preguntó cómo limitar eventuales amparos contra sus medidas económicas, dijo que rotundamente que no. Pero “Milei tiene la preocupación que políticamente, desde el Congreso, le impidan realizar su plan. Si el plan es socialmente aceptado nadie va a poner frenarlo”, afirmó. Reiteró que no se limitarán los amparos y reveló que Milei “siempre me machaca con el respeto a la Constitución de Juan Bautista Alberdi”.
El abogado penalista también trabaja en “el tema que más me preocupa: la sobrepoblación en las cárceles”. Para eso trabaja en un proyecto para implementar un sistema mixto entre el Estado y las empresas privadas en las cárceles federales.
“El sistema penitenciario está colapsado. Solo en la Capital hay más de mil presos detenidos en comisarías. La fuga del sicario conocido como “El Caníbal” es una señal de esa situación de emergencia y llama la atención que no se sepa de sumarios contra los responsables de la fuga”, agregó.
De los hábeas corpus vinculados a las cárceles “se deduce que la mayoría de las quejas de los presos es la mala calidad de la infraestructura, mala atención médica y de los cursos”, explicó.
Entonces, “tenemos que implementar un sistema como en Estados Unidos o Austria donde el Estado mantiene la facultad de la seguridad y los privados se encargan de los servicios. Incluso, con la implementación del trabajo de los presos para que se paguen sus propios gastos y al salir pueden ser resocializados sino producir, como ahora, presos que se perfeccionan como delicuentes y constituyen asociaciones ilícitas”, finalizó Cúneo."
